{
  "schema_version": "incident_scenario_catalog.v0",
  "catalog_id": "HOPS-INCIDENT-SCENARIOS-V0",
  "language": "ko",
  "status": "OWNER_CONFIRMED_TEAM_REVIEW_PENDING",
  "contains_hidden_ground_truth": true,
  "ingestion_policy": "NEVER_INGEST",
  "review": {
    "owner_reviewer": "DATA_OWNER",
    "owner_reviewed_at": "2026-10-26",
    "team_review_status": "PENDING"
  },
  "scenarios": [
    {
      "scenario_id": "SCN-IDENTITY-PASSWORD-FORGOT", "title": "비밀번호를 잊은 직원 문의", "scenario_type": "KNOWLEDGE_ONLY", "service_id": "IDENTITY", "component_candidates": ["PASSWORD_RESET"],
      "user_symptoms": ["회사 계정 비밀번호를 잊어서 로그인할 수 없다."], "hidden_cause": null, "difficulty": "BASIC",
      "artifacts": {"guide_ids": ["GUIDE-IDENTITY-PASSWORD-FORGOT"], "guide_status": "OWNER_CONFIRMED", "runbook_ids": [], "runbook_status": "NOT_REQUIRED", "policy_ids": [], "policy_status": "NOT_REQUIRED"},
      "evidence_refs": ["GE-051"], "evidence_status": "INCLUDE_CONFIRMED",
      "observations": {"required": ["사용자가 비밀번호 분실을 명시", "다른 인증 수단 사용 가능 여부"], "contradictory": ["계정 잠금 또는 MFA 오류가 주 증상"]},
      "expected": {"route": "ANSWER_OR_HANDOFF", "departments": ["ACCOUNT_PERMISSION"], "behavior": "직원이 수행할 수 있는 안전한 재설정 절차만 안내하고 실패하면 계정 권한 부서로 이관한다.", "allowed_uncertainty": "사용자별 계정 상태는 확인할 수 없으므로 원인을 단정하지 않는다."},
      "trigger": {"type": "NONE", "trigger_id": null, "status": "NOT_REQUIRED"}, "reproduction_status": "NOT_REQUIRED", "case_eligible": false, "eval_split": "NONE", "knowledge_ingest_allowed": false, "notes": "한국어 직원 가이드 작성 전이다."
    },
    {
      "scenario_id": "SCN-IDENTITY-PASSWORD-RESET", "title": "비밀번호 재설정 처리 오류", "scenario_type": "KNOWLEDGE_ONLY", "service_id": "IDENTITY", "component_candidates": ["PASSWORD_RESET"],
      "user_symptoms": ["비밀번호 재설정 요청이 처리되지 않거나 계정을 확인할 수 없다."], "hidden_cause": null, "difficulty": "INTERMEDIATE",
      "artifacts": {"guide_ids": ["GUIDE-IDENTITY-PASSWORD-RESET"], "guide_status": "OWNER_CONFIRMED", "runbook_ids": [], "runbook_status": "NOT_REQUIRED", "policy_ids": [], "policy_status": "NOT_REQUIRED"},
      "evidence_refs": ["GE-002", "GE-003", "GE-054"], "evidence_status": "MIXED",
      "observations": {"required": ["화면의 오류 문구", "재설정 경로와 시도 시각"], "contradictory": ["MFA 코드 미수신이 주 증상"]},
      "expected": {"route": "ANSWER_OR_HANDOFF", "departments": ["ACCOUNT_PERMISSION"], "behavior": "검수된 대체 절차만 안내하고 계정 확인이 필요하면 이관한다.", "allowed_uncertainty": "hold 근거에만 있는 변형은 답변 근거로 사용하지 않는다."},
      "trigger": {"type": "NONE", "trigger_id": null, "status": "NOT_REQUIRED"}, "reproduction_status": "NOT_REQUIRED", "case_eligible": false, "eval_split": "NONE", "knowledge_ingest_allowed": false, "notes": "hold 변형 병합 여부는 가이드 작성 시 결정한다."
    },
    {
      "scenario_id": "SCN-IDENTITY-MFA-LIMIT", "title": "MFA 인증 앱 등록 한도", "scenario_type": "KNOWLEDGE_ONLY", "service_id": "IDENTITY", "component_candidates": ["MFA"],
      "user_symptoms": ["MFA 인증 앱을 더 등록할 수 없다."], "hidden_cause": null, "difficulty": "INTERMEDIATE",
      "artifacts": {"guide_ids": ["GUIDE-IDENTITY-MFA-LIMIT"], "guide_status": "OWNER_CONFIRMED", "runbook_ids": ["RB-IDENTITY-MFA-RECOVERY"], "runbook_status": "OWNER_CONFIRMED", "policy_ids": [], "policy_status": "NOT_REQUIRED"},
      "evidence_refs": ["GE-001"], "evidence_status": "INCLUDE_CONFIRMED",
      "observations": {"required": ["등록 단계와 표시 오류", "기존 인증 방법 보유 여부"], "contradictory": ["휴대폰 분실로 기존 MFA를 전혀 사용할 수 없음"]},
      "expected": {"route": "ANSWER_OR_HANDOFF", "departments": ["ACCOUNT_PERMISSION"], "behavior": "직원 안전 범위의 확인만 안내하고 관리자 초기화가 필요하면 이관한다.", "allowed_uncertainty": "관리자만 확인 가능한 등록 상태를 추정하지 않는다."},
      "trigger": {"type": "NONE", "trigger_id": null, "status": "NOT_REQUIRED"}, "reproduction_status": "NOT_REQUIRED", "case_eligible": false, "eval_split": "NONE", "knowledge_ingest_allowed": false, "notes": "직원 가이드와 담당자 런북을 분리한다."
    },
    {
      "scenario_id": "SCN-IDENTITY-MFA-RECOVERY", "title": "MFA 휴대폰 분실·코드 미수신", "scenario_type": "KNOWLEDGE_ONLY", "service_id": "IDENTITY", "component_candidates": ["MFA"],
      "user_symptoms": ["휴대폰 분실 또는 번호 변경으로 인증 코드를 받을 수 없다."], "hidden_cause": null, "difficulty": "INTERMEDIATE",
      "artifacts": {"guide_ids": ["GUIDE-IDENTITY-MFA-RECOVERY"], "guide_status": "OWNER_CONFIRMED", "runbook_ids": ["RB-IDENTITY-MFA-RECOVERY"], "runbook_status": "OWNER_CONFIRMED", "policy_ids": [], "policy_status": "NOT_REQUIRED"},
      "evidence_refs": ["GE-052", "GE-053"], "evidence_status": "INCLUDE_CONFIRMED",
      "observations": {"required": ["사용 가능한 다른 인증 수단", "휴대폰 분실·번호 변경·코드 미수신 구분"], "contradictory": ["비밀번호 자체를 모름"]},
      "expected": {"route": "HANDOFF", "departments": ["ACCOUNT_PERMISSION"], "behavior": "신원 확인과 MFA 초기화가 필요한 경우 계정 권한 부서로 이관한다.", "allowed_uncertainty": "Agent는 MFA 설정을 변경하거나 초기화하지 않는다."},
      "trigger": {"type": "NONE", "trigger_id": null, "status": "NOT_REQUIRED"}, "reproduction_status": "NOT_REQUIRED", "case_eligible": false, "eval_split": "NONE", "knowledge_ingest_allowed": false, "notes": "관리자 Graph 삭제 절차는 직원에게 노출하지 않는다."
    },
    {
      "scenario_id": "SCN-IDENTITY-SSO-REDIRECT", "title": "AADSTS50011 리디렉션 URI 불일치", "scenario_type": "KNOWLEDGE_ONLY", "service_id": "IDENTITY", "component_candidates": ["SSO"],
      "user_symptoms": ["로그인 중 AADSTS50011 오류가 표시된다."], "hidden_cause": null, "difficulty": "INTERMEDIATE",
      "artifacts": {"guide_ids": [], "guide_status": "NOT_REQUIRED", "runbook_ids": [], "runbook_status": "NOT_REQUIRED", "policy_ids": [], "policy_status": "NOT_REQUIRED"},
      "evidence_refs": ["GE-007"], "evidence_status": "INCLUDE_CONFIRMED",
      "observations": {"required": ["정확한 AADSTS 오류 코드", "영향받는 애플리케이션 이름"], "contradictory": ["계정 비활성 또는 앱 역할 미할당 코드"]},
      "expected": {"route": "HANDOFF", "departments": ["BACKEND"], "behavior": "앱 설정 오류 코드 근거로 Backend 이관을 제안한다.", "allowed_uncertainty": "오류 코드가 없으면 SSO 설정 원인으로 단정하지 않는다."},
      "trigger": {"type": "NONE", "trigger_id": null, "status": "NOT_REQUIRED"}, "reproduction_status": "NOT_REQUIRED", "case_eligible": false, "eval_split": "NONE", "knowledge_ingest_allowed": false, "notes": "현재는 라우팅 Reference이며 별도 런북 승격은 미정이다."
    },
    {
      "scenario_id": "SCN-REMOTE-VPN-809", "title": "VPN 오류 809", "scenario_type": "KNOWLEDGE_ONLY", "service_id": "REMOTE_ACCESS", "component_candidates": ["VPN"],
      "user_symptoms": ["재택 접속 중 VPN 오류 809가 표시된다."], "hidden_cause": null, "difficulty": "INTERMEDIATE",
      "artifacts": {"guide_ids": ["GUIDE-REMOTE-VPN"], "guide_status": "OWNER_CONFIRMED", "runbook_ids": ["RB-REMOTE-VPN-CODES"], "runbook_status": "OWNER_CONFIRMED", "policy_ids": [], "policy_status": "NOT_REQUIRED"},
      "evidence_refs": ["GE-011"], "evidence_status": "INCLUDE_CONFIRMED",
      "observations": {"required": ["오류 코드 809", "다른 네트워크에서의 재시도 결과"], "contradictory": ["오류 코드 720 또는 인증 오류"]},
      "expected": {"route": "ANSWER_OR_HANDOFF", "departments": ["NETWORK"], "behavior": "직원 안전 확인 후 미해결이면 오류 코드와 환경을 보존해 네트워크로 이관한다.", "allowed_uncertainty": "방화벽·NPS·인증서 중 어느 원인인지는 담당자 관측 전 단정하지 않는다."},
      "trigger": {"type": "NONE", "trigger_id": null, "status": "NOT_REQUIRED"}, "reproduction_status": "NOT_REQUIRED", "case_eligible": false, "eval_split": "NONE", "knowledge_ingest_allowed": false, "notes": "PowerShell 인증서 점검 절은 STAFF 전용이다."
    },
    {
      "scenario_id": "SCN-REMOTE-VPN-720", "title": "VPN 오류 720", "scenario_type": "KNOWLEDGE_ONLY", "service_id": "REMOTE_ACCESS", "component_candidates": ["VPN"],
      "user_symptoms": ["VPN 연결 시 오류 720이 표시된다."], "hidden_cause": null, "difficulty": "ADVANCED",
      "artifacts": {"guide_ids": ["GUIDE-REMOTE-VPN"], "guide_status": "OWNER_CONFIRMED", "runbook_ids": ["RB-REMOTE-VPN-720"], "runbook_status": "OWNER_CONFIRMED", "policy_ids": [], "policy_status": "NOT_REQUIRED"},
      "evidence_refs": ["GE-012"], "evidence_status": "INCLUDE_CONFIRMED",
      "observations": {"required": ["오류 코드 720", "최근 네트워크 드라이버 또는 VPN 클라이언트 변경 여부"], "contradictory": ["오류 코드 809"]},
      "expected": {"route": "HANDOFF", "departments": ["NETWORK"], "behavior": "관리자 권한 진단이 필요함을 알리고 네트워크로 이관한다.", "allowed_uncertainty": "드라이버 원인은 담당자 확인 전 후보로만 표현한다."},
      "trigger": {"type": "NONE", "trigger_id": null, "status": "NOT_REQUIRED"}, "reproduction_status": "NOT_REQUIRED", "case_eligible": false, "eval_split": "NONE", "knowledge_ingest_allowed": false, "notes": "elevated PowerShell 절차는 직원에게 제공하지 않는다."
    },
    {
      "scenario_id": "SCN-REMOTE-WIFI-8021X", "title": "사내 Wi-Fi 802.1X 인증 실패", "scenario_type": "KNOWLEDGE_ONLY", "service_id": "REMOTE_ACCESS", "component_candidates": ["WIFI_802_1X"],
      "user_symptoms": ["사내 Wi-Fi에 연결할 때 인증에 실패한다."], "hidden_cause": null, "difficulty": "ADVANCED",
      "artifacts": {"guide_ids": ["GUIDE-REMOTE-WIFI"], "guide_status": "HOLD", "runbook_ids": ["RB-REMOTE-WIFI-8021X"], "runbook_status": "HOLD", "policy_ids": [], "policy_status": "NOT_REQUIRED"},
      "evidence_refs": ["GE-014", "GE-055"], "evidence_status": "HOLD",
      "observations": {"required": ["사내 802.1X 사용 여부", "NPS·클라이언트 인증 이벤트"], "contradictory": ["일반 인터넷 회선 장애"]},
      "expected": {"route": "HANDOFF", "departments": ["NETWORK", "ACCOUNT_PERMISSION"], "behavior": "서비스 범위와 신호가 확정되기 전에는 지식 답변 대신 담당 부서 검토로 이관한다.", "allowed_uncertainty": "네트워크와 계정 원인을 구분할 신호가 없으면 부서를 단정하지 않는다."},
      "trigger": {"type": "NONE", "trigger_id": null, "status": "NOT_REQUIRED"}, "reproduction_status": "NOT_REQUIRED", "case_eligible": false, "eval_split": "NONE", "knowledge_ingest_allowed": false, "notes": "hold 해제 전 검색 적재 금지."
    },
    {
      "scenario_id": "SCN-FILE-DRIVE-DISCONNECTED", "title": "공유 드라이브 연결 끊김", "scenario_type": "KNOWLEDGE_ONLY", "service_id": "FILE_SHARE", "component_candidates": ["SMB"],
      "user_symptoms": ["Z 드라이브에 빨간 X가 보이고 열리지 않는다."], "hidden_cause": null, "difficulty": "INTERMEDIATE",
      "artifacts": {"guide_ids": ["GUIDE-FILE-DRIVE"], "guide_status": "OWNER_CONFIRMED", "runbook_ids": ["RB-FILE-PATH"], "runbook_status": "OWNER_CONFIRMED", "policy_ids": [], "policy_status": "NOT_REQUIRED"},